{
  "$schema": "https://json-schema.org/draft/2020-12/schema",
  "$id": "https://contracts.cybrik.example/json-schema/cybrik.org-membership.v1.schema.json",
  "title": "CYBRIK org_membership v1 (D-2)",
  "description": "Binds an actor (ADR-0006 common-defs.actor) to an INTERNAL org_node with a role that maps to a capability archetype (ADR-0007 D-2; 02 §1.3). Membership confers node-scoped capability ONLY; it does NOT by itself confer descendant raw-data access (that is a separate scope grant + need-to-know, INV-1). An external authority (A05) is NEVER an org_node member (INV-2/OD-1): node_boundary_kind is const 'internal', so an external-boundary membership is structurally impossible. $id uses the RFC 2606 .example documentation domain. Status: ACCEPTED FOR IMPLEMENTATION (v0.1.0; not stable v1/GA). Accepted at Gate W2-G (Codex under Founder delegation, 2026-07-24).",
  "x-cybrik-status": "ACCEPTED FOR IMPLEMENTATION",
  "x-cybrik-not-accepted": false,
  "x-cybrik-contract-version": "0.1.0",
  "type": "object",
  "additionalProperties": false,
  "required": ["membership_id", "actor", "org_node_id", "node_boundary_kind", "tenant_id", "role", "confers_descendant_raw", "temporal"],
  "properties": {
    "membership_id": {
      "type": "string",
      "description": "Opaque membership id. Revocation targets this id.",
      "minLength": 1,
      "maxLength": 128
    },
    "actor": {
      "allOf": [
        { "$ref": "cybrik.common-defs.v1.schema.json#/$defs/actor" },
        { "required": ["tenant_id"] }
      ],
      "description": "The member. tenant_id is required here (cross-tenant authorization site). Model output can never populate an actor (ADR-0006)."
    },
    "org_node_id": {
      "$ref": "cybrik.org-common-defs.v1.schema.json#/$defs/orgNodeId",
      "description": "The node the actor is a member of."
    },
    "node_boundary_kind": {
      "type": "string",
      "description": "The boundary of the bound node. Const 'internal': membership is only to an internal governed node. An external (A05) peer is an exchange peer, never a member (INV-2/OD-1) — an 'external' value is not expressible.",
      "const": "internal"
    },
    "tenant_id": {
      "$ref": "cybrik.common-defs.v1.schema.json#/$defs/tenantId",
      "description": "The node's tenant. MUST equal actor.tenant_id and the node's tenant_binding (runtime cross-tenant guard; OD-1)."
    },
    "role": { "$ref": "cybrik.org-common-defs.v1.schema.json#/$defs/roleArchetype" },
    "confers_descendant_raw": {
      "type": "boolean",
      "description": "Const false: membership NEVER confers descendant raw-data access by itself. Raw descendant access requires a separate explicit scope grant + need-to-know (INV-1; 02 §1.3, §2.5).",
      "const": false
    },
    "temporal": {
      "$ref": "cybrik.org-common-defs.v1.schema.json#/$defs/grantTemporal",
      "description": "Membership is expiring and revocable like any grant (02 §5.4)."
    }
  }
}
